{
  "schema_version": "identity-prime.tag-assignment.v1",
  "assignment_id": "ta_intent_learning_0001",
  "subject_ref": "tp_subject_chameleon::tok_xH2ban6",
  "masking_decision_ref": "md_subject_tokenize_0007",
  "tag_ref": "at_intent_learning",
  "method": "behavioral",
  "confidence": { "score": 0.78, "uncertainty": 0.12, "abstained": false },
  "evidence_refs": ["ew_tutorial_sessions_0003", "ew_howto_search_0004"],
  "scope_realm": "CITIZEN_CLOUD",
  "policy_verdict": {
    "verdict": "allowed",
    "gated_by_constraint": null,
    "forbidden_mixture": null,
    "reason_codes": ["NO_FORBIDDEN_MIXTURE", "NOT_MINOR_CONTEXT"]
  },
  "reversible": true,
  "expiry_ts": "2026-09-29T16:00:00Z",
  "decided_by": "audience-tagging-agent",
  "resolver_version": "regis.resolver.reference@0.1.0",
  "policy_version": "regis.identity.polytope.core@0.1.0",
  "created_at": "2026-06-29T16:01:00Z"
}
